,Serving,Calories,Total Fat (g),Saturated Fat (g),Polyunsaturated Fat (g),Monounsaturated Fat (g),Cholesterol (g),Sodium (g),Total Carbohydrate (g),Sugars (g),Protein (g),Calcium (g),Potassium (g),Iron (g),Vitamin A (g),Vitamin C (g),Dietary Fiber (g),Caffeine (g),Trans Fat (g),Alcohol (g)
"Roasted Chicken Thigh, with skin",portion (4 oz),279.0,17.5,4.9,3.9,6.9,0.105,0.095,,,28.3,0.014,0.251,0.002,0.186,,,,,
"Roasted Chicken Thigh, without skin",portion (4 oz),236.0,12.3,3.4,2.8,4.7,0.107,0.099,,,29.3,0.014,0.269,0.001,0.073,,,,,
"Chicken Thigh, without skin, raw",portion (4 oz),134.0,4.4,1.1,1.1,1.4,0.094,0.097,,,22.2,0.011,0.261,0.001,0.073,,,,0.1,
"Ginger Root, raw",teaspoon (0.1 oz),2.0,0.0,0.0,0.0,0.0,,0.0,0.4,0.0,0.0,0.0,0.008,0.0,,0.0,0.0,,,
"Spinach, raw",cup (1.1 oz),7.0,0.1,0.0,0.0,0.0,,0.024,1.1,0.1,0.9,0.03,0.167,0.0,2.813,0.008,0.7,,,
"Celery, raw","stalk, 7"" long (1.4 oz)",6.0,0.0,0.0,0.0,0.0,,0.032,1.4,0.7,0.3,0.016,0.104,0.0,0.18,0.001,0.6,,,
"Phillips Crab Meat, Jumbo Lump",serving (2 oz),40.0,,,,,0.045,0.18,,,10.0,,,,,,,,,
"Phillips Crab Meat, Claw Meat",serving (2 oz),40.0,,,,,0.045,0.18,,,10.0,,,,,,,,,
"Phillips Crab Meat, Backfin",serving (2 oz),40.0,,,,,0.045,0.18,,,10.0,,,,,,,,,
"Bread Crumbs, Plain, dry",cup (3.8 oz),426.0,5.7,1.3,2.2,1.1,,0.791,77.7,6.7,14.4,0.198,0.212,0.005,,,4.9,,,
Progresso Italian Style Bread Crumbs,cup (4 oz),440.0,6.0,2.0,,,,1.8,80.0,8.0,16.0,0.16,,0.006,,,4.0,,,
Progresso Plain Bread Crumbs,cup (4 oz),440.0,6.0,2.0,,,,0.8,80.0,8.0,16.0,0.16,,0.004,,,4.0,,,
Centrella Red Maraschino Cherries,cherry (0.2 oz),10.0,,,,,,,2.0,1.0,,,,,,,,,,
Fresh & Easy Black-Eyed Peas,1/4 cup (1.6 oz),150.0,0.5,,,,,0.005,27.0,3.0,11.0,0.04,,0.004,,,5.0,,,
Luby's Black-Eyed Peas,cup (8 fl. oz),255.0,4.0,,,,,,40.0,,15.0,,,,,,11.0,,,
Piccadilly Cafeteria Black-Eyed Peas,order,193.0,2.0,1.0,,,0.002,0.728,32.0,4.0,12.0,,,,,,5.0,,,
